numero,url,nome,tipos,Peso_kg,altura_cm,efetividade_dict,habilidades_nomes,habilidades_urls,habilidades_descricoes,numero_evol,level_evol,item_evol,nome_evol,url_evol
256,https://pokemondb.net/pokedex/combusken,Combusken,"Fire, Fighting",19.5,90.0,"{'Nor': 1.0, 'Fir': 0.5, 'Wat': 2.0, 'Ele': 1.0, 'Gra': 0.5, 'Ice': 0.5, 'Fig': 1.0, 'Poi': 1.0, 'Gro': 2.0}",Speed Boost; Blaze,https://pokemondb.net/ability/speed-boost; https://pokemondb.net/ability/blaze,Its Speed stat is gradually boosted.; Blaze increases the power of Fire -type moves by 50% (1.5×) when the ability-bearer's HP falls below a third of its maximum (known in-game as in a pinch ).,257,None,None,Blaziken,https://pokemondb.net/pokedex/blaziken
257,https://pokemondb.net/pokedex/blaziken,Blaziken,"Fire, Fighting",52.0,190.0,"{'Nor': 1.0, 'Fir': 0.5, 'Wat': 2.0, 'Ele': 1.0, 'Gra': 0.5, 'Ice': 0.5, 'Fig': 1.0, 'Poi': 1.0, 'Gro': 2.0}",Speed Boost; Blaze,https://pokemondb.net/ability/speed-boost; https://pokemondb.net/ability/blaze,Its Speed stat is gradually boosted.; Blaze increases the power of Fire -type moves by 50% (1.5×) when the ability-bearer's HP falls below a third of its maximum (known in-game as in a pinch ).,None,None,None,None,None
258,https://pokemondb.net/pokedex/mudkip,Mudkip,Water,7.6,40.0,"{'Nor': 1.0, 'Fir': 0.5, 'Wat': 0.5, 'Ele': 2.0, 'Gra': 2.0, 'Ice': 0.5, 'Fig': 1.0, 'Poi': 1.0, 'Gro': 1.0}",Damp; Torrent,https://pokemondb.net/ability/damp; https://pokemondb.net/ability/torrent,Damp prevents all Pokémon on the field from using the moves Selfdestruct and Explosion . It also prevents damage (to the Damp Pokémon only) from the ability Aftermath .; Torrent increases the power of Water -type moves by 50% (1.5×) when the ability-bearer's HP falls below a third of its maximum (known in-game as in a pinch ).,259; 260,36; None,None; None,Marshtomp; Swampert,https://pokemondb.net/pokedex/marshtomp; https://pokemondb.net/pokedex/swampert
259,https://pokemondb.net/pokedex/marshtomp,Marshtomp,"Water, Ground",28.0,70.0,"{'Nor': 1.0, 'Fir': 0.5, 'Wat': 1.0, 'Ele': 0.0, 'Gra': 4.0, 'Ice': 1.0, 'Fig': 1.0, 'Poi': 0.5, 'Gro': 1.0}",Damp; Torrent,https://pokemondb.net/ability/damp; https://pokemondb.net/ability/torrent,Damp prevents all Pokémon on the field from using the moves Selfdestruct and Explosion . It also prevents damage (to the Damp Pokémon only) from the ability Aftermath .; Torrent increases the power of Water -type moves by 50% (1.5×) when the ability-bearer's HP falls below a third of its maximum (known in-game as in a pinch ).,260,None,None,Swampert,https://pokemondb.net/pokedex/swampert
229,https://pokemondb.net/pokedex/houndoom,Houndoom,"Dark, Fire",35.0,140.0,"{'Nor': 1.0, 'Fir': 0.5, 'Wat': 2.0, 'Ele': 1.0, 'Gra': 0.5, 'Ice': 0.5, 'Fig': 2.0, 'Poi': 1.0, 'Gro': 2.0}",Unnerve; Flash Fire; Early Bird,https://pokemondb.net/ability/unnerve; https://pokemondb.net/ability/flash-fire; https://pokemondb.net/ability/early-bird,"Makes the foe nervous and unable to eat Berries.; When a Pokémon with Flash Fire is hit by a Fire-type move, it does not deal damage but instead raises the power of the bearer's Fire-type moves by 50%. Subsequent hits do not raise the power even more, but the effect remains while the ability-bearer is in battle.; The Pokémon awakens quickly from sleep.",None,None,None,None,None
230,https://pokemondb.net/pokedex/kingdra,Kingdra,"Water, Dragon",152.0,180.0,"{'Nor': 1.0, 'Fir': 0.25, 'Wat': 0.25, 'Ele': 1.0, 'Gra': 1.0, 'Ice': 1.0, 'Fig': 1.0, 'Poi': 1.0, 'Gro': 1.0}",Damp; Sniper; Swift Swim,https://pokemondb.net/ability/damp; https://pokemondb.net/ability/sniper; https://pokemondb.net/ability/swift-swim,"Damp prevents all Pokémon on the field from using the moves Selfdestruct and Explosion . It also prevents damage (to the Damp Pokémon only) from the ability Aftermath .; Sniper increases the power of critical hits by 1.5×. This means a critical hit will deal 2.25× normal damage instead of 1.5×. In Generations 1-5 critical hits deal 2× normal damage, so Sniper inflicts 3× normal damage.; Swift Swim doubles the ability-bearer's Speed during rain .",None,None,None,None,None
231,https://pokemondb.net/pokedex/phanpy,Phanpy,Ground,33.5,50.0,"{'Nor': 1.0, 'Fir': 1.0, 'Wat': 2.0, 'Ele': 0.0, 'Gra': 2.0, 'Ice': 2.0, 'Fig': 1.0, 'Poi': 0.5, 'Gro': 1.0}",Sand Veil; Pickup,https://pokemondb.net/ability/sand-veil; https://pokemondb.net/ability/pickup,"Sand Veil raises the ability-bearer's evasion by 20% in a sandstorm . It also gives immunity to sandstorm damage (if they are not already protected by being Ground / Rock / Steel type). If a Pokémon with Sand Veil is the leading party Pokémon while travelling in a sandstorm, wild Pokémon are only half as likely to appear.; When another Pokémon on the field uses a single-use held item, a Pokémon with Pickup will obtain the used item (if they are not already holding anything) and it can be used again. Pokémon with Pickup will also obtain an item thrown at them with Fling (if they are not already holding anything). In Generations 3-4 , Pickup has no effect in battle. When a battle ends, any party Pokémon with Pickup has a 10% chance of picking up an item (if they are not already holding an item). Items picked up range from Potions, Great Balls, Ultra Balls and Rare Candies up to Leftovers and some TMs. Better items have a lower chance of being found; furthermore, higher-level Pokémon will obtain better items.",232,None,None,Donphan,https://pokemondb.net/pokedex/donphan
232,https://pokemondb.net/pokedex/donphan,Donphan,Ground,120.0,110.0,"{'Nor': 1.0, 'Fir': 1.0, 'Wat': 2.0, 'Ele': 0.0, 'Gra': 2.0, 'Ice': 2.0, 'Fig': 1.0, 'Poi': 0.5, 'Gro': 1.0}",Sand Veil; Sturdy,https://pokemondb.net/ability/sand-veil; https://pokemondb.net/ability/sturdy,"Sand Veil raises the ability-bearer's evasion by 20% in a sandstorm . It also gives immunity to sandstorm damage (if they are not already protected by being Ground / Rock / Steel type). If a Pokémon with Sand Veil is the leading party Pokémon while travelling in a sandstorm, wild Pokémon are only half as likely to appear.; Sturdy allows the Pokémon to survive with 1 HP if attacked at full HP with an attack that would otherwise knock it out. It also prevents One-Hit-KO moves ( Fissure , Horn Drill , Guillotine or Sheer Cold ). If Sturdy activates before the final hit of a multi-hit move (such as Fury Swipes ), the subsequent hit will still deal damage and therefore cause the Pokémon to faint. Sturdy does not prevent self-inflicted KO moves such as Selfdestruct , Explosion and Final Gambit .",None,None,None,None,None
233,https://pokemondb.net/pokedex/porygon2,Porygon2,Normal,32.5,60.0,"{'Nor': 1.0, 'Fir': 1.0, 'Wat': 1.0, 'Ele': 1.0, 'Gra': 1.0, 'Ice': 1.0, 'Fig': 2.0, 'Poi': 1.0, 'Gro': 1.0}",Analytic; Download; Trace,https://pokemondb.net/ability/analytic; https://pokemondb.net/ability/download; https://pokemondb.net/ability/trace,"Boosts move power when the Pokémon moves last.; Download raises either the bearer's Attack or Special Attack by one stage when switching into battle, base on the opponent's defenses. It raises Attack if the opponent's Defense is lower than its Special Defense, or raises Special Attack if opponent's Special Defense is lower than or equal to its Defense. In double and triple battles, Download compares the sum of all opponents' Defense stats and the sum of all opponents' Special Defense stats and uses the lowest total.; The Pokémon copies a foe's Ability.",474,None,None,Porygon-Z,https://pokemondb.net/pokedex/porygon-z
234,https://pokemondb.net/pokedex/stantler,Stantler,Normal,71.2,140.0,"{'Nor': 1.0, 'Fir': 1.0, 'Wat': 1.0, 'Ele': 1.0, 'Gra': 1.0, 'Ice': 1.0, 'Fig': 2.0, 'Poi': 1.0, 'Gro': 1.0}",Sap Sipper; Frisk; Intimidate,https://pokemondb.net/ability/sap-sipper; https://pokemondb.net/ability/frisk; https://pokemondb.net/ability/intimidate,"Boosts Attack when hit by a Grass-type move.; The Pokémon can check a foe's held item.; Intimidate lower's the Attack of all opponents by one stage when the ability-bearer switches in (including the start of a battle). Stats can be lowered to a minimum of -6 stages each. If a Pokémon with Intimidate is the leading party Pokémon, wild Pokémon are 50% less likely to be lower level.",899,None,None,Wyrdeer,https://pokemondb.net/pokedex/wyrdeer
235,https://pokemondb.net/pokedex/smeargle,Smeargle,Normal,58.0,120.0,"{'Nor': 1.0, 'Fir': 1.0, 'Wat': 1.0, 'Ele': 1.0, 'Gra': 1.0, 'Ice': 1.0, 'Fig': 2.0, 'Poi': 1.0, 'Gro': 1.0}",Moody; Technician; Own Tempo,https://pokemondb.net/ability/moody; https://pokemondb.net/ability/technician; https://pokemondb.net/ability/own-tempo,"Raises one stat and lowers another.; Technician increases the power of moves - that are usually base power 60 or below - by 50%. Moves with variable base power are boosted only when it is 60 or below. For example, if Magnitude hits at level 6 it will be boosted from 50 to 75, but level 7 will stay at 70 base power. Moves like Sonic Boom that deal fixed HP damage are not affected by Technician .; Prevents the Pokémon from becoming confused.",None,None,None,None,None
236,https://pokemondb.net/pokedex/tyrogue,Tyrogue,Fighting,21.0,70.0,"{'Nor': 1.0, 'Fir': 1.0, 'Wat': 1.0, 'Ele': 1.0, 'Gra': 1.0, 'Ice': 1.0, 'Fig': 1.0, 'Poi': 1.0, 'Gro': 1.0}",Vital Spirit; Steadfast; Guts,https://pokemondb.net/ability/vital-spirit; https://pokemondb.net/ability/steadfast; https://pokemondb.net/ability/guts,"Vital Spirit prevents the ability-bearer from falling asleep. This means that it also prevents the use of the move Rest . If a Pokémon with Vital Spirit is the leading party Pokémon, wild Pokémon are 50% more likely to be higher level.; Raises Speed each time the Pokémon flinches.; Guts raises the ability-bearer's Attack by 50% when inflicted by a major status ailment (poison, burn, paralysis, freeze or sleep). If burnt, the Pokémon does not suffer the usual drop in Attack. All other effects of the status condition remain, e.g. losing HP each turn (poison, burn), speed drop (paralysis) or being unable to attack (paralysis, freeze, sleep).",106; 107; 237,20; 20; 20,None; None; None,None; None; None,None; None; None
237,https://pokemondb.net/pokedex/hitmontop,Hitmontop,Fighting,48.0,140.0,"{'Nor': 1.0, 'Fir': 1.0, 'Wat': 1.0, 'Ele': 1.0, 'Gra': 1.0, 'Ice': 1.0, 'Fig': 1.0, 'Poi': 1.0, 'Gro': 1.0}",Steadfast; Technician; Intimidate,https://pokemondb.net/ability/steadfast; https://pokemondb.net/ability/technician; https://pokemondb.net/ability/intimidate,"Raises Speed each time the Pokémon flinches.; Technician increases the power of moves - that are usually base power 60 or below - by 50%. Moves with variable base power are boosted only when it is 60 or below. For example, if Magnitude hits at level 6 it will be boosted from 50 to 75, but level 7 will stay at 70 base power. Moves like Sonic Boom that deal fixed HP damage are not affected by Technician .; Intimidate lower's the Attack of all opponents by one stage when the ability-bearer switches in (including the start of a battle). Stats can be lowered to a minimum of -6 stages each. If a Pokémon with Intimidate is the leading party Pokémon, wild Pokémon are 50% less likely to be lower level.",None,None,None,None,None
238,https://pokemondb.net/pokedex/smoochum,Smoochum,"Ice, Psychic",6.0,40.0,"{'Nor': 1.0, 'Fir': 2.0, 'Wat': 1.0, 'Ele': 1.0, 'Gra': 1.0, 'Ice': 0.5, 'Fig': 1.0, 'Poi': 1.0, 'Gro': 1.0}",Hydration; Forewarn; Oblivious,https://pokemondb.net/ability/hydration; https://pokemondb.net/ability/forewarn; https://pokemondb.net/ability/oblivious,"A Pokémon with Hydration will cure itself of any status conditions during rain, at the end of each turn. This includes self-inflicted conditions such as from using Rest .; Determines what moves a foe has.; Oblivious makes the Pokémon immune to gender-based moves and abilities, specifically Attract , Captivate and Cute Charm .",124,None,None,Jynx,https://pokemondb.net/pokedex/jynx
239,https://pokemondb.net/pokedex/elekid,Elekid,Electric,23.5,60.0,"{'Nor': 1.0, 'Fir': 1.0, 'Wat': 1.0, 'Ele': 0.5, 'Gra': 1.0, 'Ice': 1.0, 'Fig': 1.0, 'Poi': 1.0, 'Gro': 2.0}",Vital Spirit; Static,https://pokemondb.net/ability/vital-spirit; https://pokemondb.net/ability/static,"Vital Spirit prevents the ability-bearer from falling asleep. This means that it also prevents the use of the move Rest . If a Pokémon with Vital Spirit is the leading party Pokémon, wild Pokémon are 50% more likely to be higher level.; If a Pokémon with Static is hit by a move making contact, there is a 30% chance the foe will become paralyzed. If a Pokémon with Static is the leading party Pokémon, it is 50% more likely that a wild Pokémon encountered will be Electric type.",125; 466,None; None,None; None,Electabuzz; Electivire,https://pokemondb.net/pokedex/electabuzz; https://pokemondb.net/pokedex/electivire
240,https://pokemondb.net/pokedex/magby,Magby,Fire,21.4,70.0,"{'Nor': 1.0, 'Fir': 0.5, 'Wat': 2.0, 'Ele': 1.0, 'Gra': 0.5, 'Ice': 0.5, 'Fig': 1.0, 'Poi': 1.0, 'Gro': 2.0}",Vital Spirit; Flame Body,https://pokemondb.net/ability/vital-spirit; https://pokemondb.net/ability/flame-body,"Vital Spirit prevents the ability-bearer from falling asleep. This means that it also prevents the use of the move Rest . If a Pokémon with Vital Spirit is the leading party Pokémon, wild Pokémon are 50% more likely to be higher level.; If a Pokémon with Flame Body is hit by a move that makes contact, there is a 30% chance the attacker will become burned. If a Pokémon with Flame Body (or Magma Armor or Steam Engine ) and a Pokémon Egg are both in the party Pokémon, the number of steps required to hatch the egg are halved.",126; 467,None; None,None; None,Magmar; Magmortar,https://pokemondb.net/pokedex/magmar; https://pokemondb.net/pokedex/magmortar
241,https://pokemondb.net/pokedex/miltank,Miltank,Normal,75.5,120.0,"{'Nor': 1.0, 'Fir': 0.5, 'Wat': 1.0, 'Ele': 1.0, 'Gra': 1.0, 'Ice': 0.5, 'Fig': 2.0, 'Poi': 1.0, 'Gro': 1.0}",Sap Sipper; Scrappy; Thick Fat,https://pokemondb.net/ability/sap-sipper; https://pokemondb.net/ability/scrappy; https://pokemondb.net/ability/thick-fat,"Boosts Attack when hit by a Grass-type move.; Enables moves to hit Ghost-type Pokémon.; Thick Fat reduces the damage taken from Fire -type and Ice -type moves by 50%. Interestingly, many Pokémon possessing this ability already take reduced damage from those types. A Dewgong or Walrein with Thick Fat would take 1 ⁄ 8 normal damage when hit by an Ice-type move.",None,None,None,None,None
242,https://pokemondb.net/pokedex/blissey,Blissey,Normal,46.8,150.0,"{'Nor': 1.0, 'Fir': 1.0, 'Wat': 1.0, 'Ele': 1.0, 'Gra': 1.0, 'Ice': 1.0, 'Fig': 2.0, 'Poi': 1.0, 'Gro': 1.0}",Healer; Serene Grace; Natural Cure,https://pokemondb.net/ability/healer; https://pokemondb.net/ability/serene-grace; https://pokemondb.net/ability/natural-cure,"May heal an ally's status conditions.; Serene Grace doubles the chance of moves' secondary effects occurring - specifically stat changes, status ailments, or flinching. It also increases the chance of flinching due to the held items King's Rock and Razor Fang from 10% to 20% (however, note that those items do not affect moves that already have a flinch chance). Serene Grace does not affect status moves or the Pokémon's critical hit ratio. Shadow Ball normally has a 20% chance of lowering Special Defense; with Serene Grace it is boosted to a 40% chance. Air Slash has a 30% of causing the target to flinch; with Serene Grace it is boosted to a 60% chance. If the item King's Rock is held it does not increase that percentage, but rather if the move does not cause flinching (40% chance), then there is now a further 20% chance the target will flinch from King's Rock . This means Serene Grace with Air Slash and King's Rock gives a total probability of 68% (1 - 0.4*0.8) that the opponent will flinch. In Generations 3-4 Serene Grace does not increase the flinch chance of King's Rock or Razor Fang. In Generations 3-5 Serene Grace does not affect the move Secret Power .; All status problems heal when it switches out.",None,None,None,None,None
243,https://pokemondb.net/pokedex/raikou,Raikou,Electric,178.0,190.0,"{'Nor': 1.0, 'Fir': 1.0, 'Wat': 1.0, 'Ele': 0.5, 'Gra': 1.0, 'Ice': 1.0, 'Fig': 1.0, 'Poi': 1.0, 'Gro': 2.0}",Inner Focus; Pressure,https://pokemondb.net/ability/inner-focus; https://pokemondb.net/ability/pressure,"Inner Focus prevents the Pokémon from flinching, for example when attacked by a move like Headbutt .; Pressure makes any attack targeted at the ability-bearer - regardless of whether it hits - use 2 PP instead of 1. If a Pokémon with Pressure is the leading party Pokémon, wild Pokémon are 50% more likely to be higher level.",None,None,None,None,None
244,https://pokemondb.net/pokedex/entei,Entei,Fire,198.0,210.0,"{'Nor': 1.0, 'Fir': 0.5, 'Wat': 2.0, 'Ele': 1.0, 'Gra': 0.5, 'Ice': 0.5, 'Fig': 1.0, 'Poi': 1.0, 'Gro': 2.0}",Inner Focus; Pressure,https://pokemondb.net/ability/inner-focus; https://pokemondb.net/ability/pressure,"Inner Focus prevents the Pokémon from flinching, for example when attacked by a move like Headbutt .; Pressure makes any attack targeted at the ability-bearer - regardless of whether it hits - use 2 PP instead of 1. If a Pokémon with Pressure is the leading party Pokémon, wild Pokémon are 50% more likely to be higher level.",None,None,None,None,None
245,https://pokemondb.net/pokedex/suicune,Suicune,Water,187.0,200.0,"{'Nor': 1.0, 'Fir': 0.5, 'Wat': 0.5, 'Ele': 2.0, 'Gra': 2.0, 'Ice': 0.5, 'Fig': 1.0, 'Poi': 1.0, 'Gro': 1.0}",Inner Focus; Pressure,https://pokemondb.net/ability/inner-focus; https://pokemondb.net/ability/pressure,"Inner Focus prevents the Pokémon from flinching, for example when attacked by a move like Headbutt .; Pressure makes any attack targeted at the ability-bearer - regardless of whether it hits - use 2 PP instead of 1. If a Pokémon with Pressure is the leading party Pokémon, wild Pokémon are 50% more likely to be higher level.",None,None,None,None,None
215,https://pokemondb.net/pokedex/sneasel,Sneasel,"Dark, Ice",28.0,90.0,"{'Nor': 1.0, 'Fir': 2.0, 'Wat': 1.0, 'Ele': 1.0, 'Gra': 1.0, 'Ice': 0.5, 'Fig': 4.0, 'Poi': 1.0, 'Gro': 1.0}",Pickpocket; Keen Eye; Inner Focus,https://pokemondb.net/ability/pickpocket; https://pokemondb.net/ability/keen-eye; https://pokemondb.net/ability/inner-focus,"Steals an item when hit by another Pokémon.; Keen Eye prevents the Pokémon from losing accuracy, for example from moves like Sand-Attack . If a Pokémon with Keen Eye is the leading party Pokémon, wild Pokémon are 50% less likely to be lower level.; Inner Focus prevents the Pokémon from flinching, for example when attacked by a move like Headbutt .",461; 903,None; None,None; None,Weavile; None,https://pokemondb.net/pokedex/weavile; None
216,https://pokemondb.net/pokedex/teddiursa,Teddiursa,Normal,8.8,60.0,"{'Nor': 1.0, 'Fir': 1.0, 'Wat': 1.0, 'Ele': 1.0, 'Gra': 1.0, 'Ice': 1.0, 'Fig': 2.0, 'Poi': 1.0, 'Gro': 1.0}",Honey Gather; Quick Feet; Pickup,https://pokemondb.net/ability/honey-gather; https://pokemondb.net/ability/quick-feet; https://pokemondb.net/ability/pickup,"Honey Gather has no effect in battle. When a battle ends, any party Pokémon with Honey Gather may pick up honey as a held item (if they are not already holding an item).; Quick Feet raises the ability-bearer's Speed by 50% when inflicted by a major status ailment (poison, burn, paralysis, freeze or sleep). If paralyzed, the Pokémon does not suffer the usual drop in Speed. All other effects of the status condition remain, e.g. losing HP each turn (poison, burn), or being unable to attack (paralysis, freeze, sleep). If a Pokémon with Quick Feet is the leading party Pokémon, wild Pokémon are only half as likely to appear.; When another Pokémon on the field uses a single-use held item, a Pokémon with Pickup will obtain the used item (if they are not already holding anything) and it can be used again. Pokémon with Pickup will also obtain an item thrown at them with Fling (if they are not already holding anything). In Generations 3-4 , Pickup has no effect in battle. When a battle ends, any party Pokémon with Pickup has a 10% chance of picking up an item (if they are not already holding an item). Items picked up range from Potions, Great Balls, Ultra Balls and Rare Candies up to Leftovers and some TMs. Better items have a lower chance of being found; furthermore, higher-level Pokémon will obtain better items.",217; 901,None; None,None; None,Ursaring; Ursaluna,https://pokemondb.net/pokedex/ursaring; https://pokemondb.net/pokedex/ursaluna
217,https://pokemondb.net/pokedex/ursaring,Ursaring,Normal,125.8,180.0,"{'Nor': 1.0, 'Fir': 1.0, 'Wat': 1.0, 'Ele': 1.0, 'Gra': 1.0, 'Ice': 1.0, 'Fig': 2.0, 'Poi': 1.0, 'Gro': 1.0}",Unnerve; Quick Feet; Guts,https://pokemondb.net/ability/unnerve; https://pokemondb.net/ability/quick-feet; https://pokemondb.net/ability/guts,"Makes the foe nervous and unable to eat Berries.; Quick Feet raises the ability-bearer's Speed by 50% when inflicted by a major status ailment (poison, burn, paralysis, freeze or sleep). If paralyzed, the Pokémon does not suffer the usual drop in Speed. All other effects of the status condition remain, e.g. losing HP each turn (poison, burn), or being unable to attack (paralysis, freeze, sleep). If a Pokémon with Quick Feet is the leading party Pokémon, wild Pokémon are only half as likely to appear.; Guts raises the ability-bearer's Attack by 50% when inflicted by a major status ailment (poison, burn, paralysis, freeze or sleep). If burnt, the Pokémon does not suffer the usual drop in Attack. All other effects of the status condition remain, e.g. losing HP each turn (poison, burn), speed drop (paralysis) or being unable to attack (paralysis, freeze, sleep).",901,None,None,Ursaluna,https://pokemondb.net/pokedex/ursaluna
218,https://pokemondb.net/pokedex/slugma,Slugma,Fire,35.0,70.0,"{'Nor': 1.0, 'Fir': 0.5, 'Wat': 2.0, 'Ele': 1.0, 'Gra': 0.5, 'Ice': 0.5, 'Fig': 1.0, 'Poi': 1.0, 'Gro': 2.0}",Weak Armor; Flame Body; Magma Armor,https://pokemondb.net/ability/weak-armor; https://pokemondb.net/ability/flame-body; https://pokemondb.net/ability/magma-armor,"When a Pokémon with Weak Armor is hit by a physical move, its Defense drops one stage, but its Speed increases by one stage. Stats can be raised to a maximum of +6 stages each, or lowered to a minimum of -6 stages each.; If a Pokémon with Flame Body is hit by a move that makes contact, there is a 30% chance the attacker will become burned. If a Pokémon with Flame Body (or Magma Armor or Steam Engine ) and a Pokémon Egg are both in the party Pokémon, the number of steps required to hatch the egg are halved.; Magma Armor prevents the Pokémon from becoming frozen, for example from moves like Blizzard . If a Pokémon with Magma Armor (or Flame Body or Steam Engine ) and a Pokémon Egg are amongst the party Pokémon, the number of steps required to hatch the egg are halved.",219,None,None,Magcargo,https://pokemondb.net/pokedex/magcargo
219,https://pokemondb.net/pokedex/magcargo,Magcargo,"Fire, Rock",55.0,80.0,"{'Nor': 0.5, 'Fir': 0.25, 'Wat': 4.0, 'Ele': 1.0, 'Gra': 1.0, 'Ice': 0.5, 'Fig': 2.0, 'Poi': 0.5, 'Gro': 4.0}",Weak Armor; Flame Body; Magma Armor,https://pokemondb.net/ability/weak-armor; https://pokemondb.net/ability/flame-body; https://pokemondb.net/ability/magma-armor,"When a Pokémon with Weak Armor is hit by a physical move, its Defense drops one stage, but its Speed increases by one stage. Stats can be raised to a maximum of +6 stages each, or lowered to a minimum of -6 stages each.; If a Pokémon with Flame Body is hit by a move that makes contact, there is a 30% chance the attacker will become burned. If a Pokémon with Flame Body (or Magma Armor or Steam Engine ) and a Pokémon Egg are both in the party Pokémon, the number of steps required to hatch the egg are halved.; Magma Armor prevents the Pokémon from becoming frozen, for example from moves like Blizzard . If a Pokémon with Magma Armor (or Flame Body or Steam Engine ) and a Pokémon Egg are amongst the party Pokémon, the number of steps required to hatch the egg are halved.",None,None,None,None,None
220,https://pokemondb.net/pokedex/swinub,Swinub,"Ice, Ground",6.5,40.0,"{'Nor': 1.0, 'Fir': 2.0, 'Wat': 2.0, 'Ele': 0.0, 'Gra': 2.0, 'Ice': 1.0, 'Fig': 2.0, 'Poi': 0.5, 'Gro': 1.0}",Thick Fat; Snow Cloak; Oblivious,https://pokemondb.net/ability/thick-fat; https://pokemondb.net/ability/snow-cloak; https://pokemondb.net/ability/oblivious,"Thick Fat reduces the damage taken from Fire -type and Ice -type moves by 50%. Interestingly, many Pokémon possessing this ability already take reduced damage from those types. A Dewgong or Walrein with Thick Fat would take 1 ⁄ 8 normal damage when hit by an Ice-type move.; Snow Cloak raises ability-bearer's evasion by 20% in a hail storm. It also gives immunity to damage by hail (if they are not already protected by being Ice type). If a Pokémon with Snow Cloak is the leading party Pokémon while travelling in a hail storm/blizzard, wild Pokémon are only half as likely to appear.; Oblivious makes the Pokémon immune to gender-based moves and abilities, specifically Attract , Captivate and Cute Charm .",221; 473,None; None,None; None,Piloswine; Mamoswine,https://pokemondb.net/pokedex/piloswine; https://pokemondb.net/pokedex/mamoswine
