numero,url,nome,tipos,Peso_kg,altura_cm,efetividade_dict,habilidades_nomes,habilidades_urls,habilidades_descricoes,numero_evol,level_evol,item_evol,nome_evol,url_evol
535,https://pokemondb.net/pokedex/tympole,Tympole,Water,4.5,50.0,"{'Nor': 1.0, 'Fir': 0.5, 'Wat': 0.5, 'Ele': 2.0, 'Gra': 2.0, 'Ice': 0.5, 'Fig': 1.0, 'Poi': 1.0, 'Gro': 1.0}",Water Absorb; Hydration; Swift Swim,https://pokemondb.net/ability/water-absorb; https://pokemondb.net/ability/hydration; https://pokemondb.net/ability/swift-swim,"A Pokémon with Water Absorb heals 1 ⁄ 4 of its maximum HP when hit by a Water -type attack.; A Pokémon with Hydration will cure itself of any status conditions during rain, at the end of each turn. This includes self-inflicted conditions such as from using Rest .; Swift Swim doubles the ability-bearer's Speed during rain .",536; 537,36; None,None; None,Palpitoad; Seismitoad,https://pokemondb.net/pokedex/palpitoad; https://pokemondb.net/pokedex/seismitoad
511,https://pokemondb.net/pokedex/pansage,Pansage,Grass,10.5,60.0,"{'Nor': 1.0, 'Fir': 2.0, 'Wat': 0.5, 'Ele': 0.5, 'Gra': 0.5, 'Ice': 2.0, 'Fig': 1.0, 'Poi': 2.0, 'Gro': 0.5}",Overgrow; Gluttony,https://pokemondb.net/ability/overgrow; https://pokemondb.net/ability/gluttony,"Overgrow increases the power of Grass -type moves by 50% (1.5×) when the ability-bearer's HP falls below a third of its maximum (known in-game as in a pinch ).; A Pokémon with Gluttony will use a pinch berry when its HP drops to 50%, rather than the usual 25%. Pinch berries are: Figy, Wiki, Mago, Aguav, Iapapa, Liechi, Ganlon, Salac, Petaya, Apicot, Lansat, Starf, Micle and Custap. (Their descriptions state that they work in a pinch. )",512,None,None,Simisage,https://pokemondb.net/pokedex/simisage
504,https://pokemondb.net/pokedex/patrat,Patrat,Normal,11.6,50.0,"{'Nor': 1.0, 'Fir': 1.0, 'Wat': 1.0, 'Ele': 1.0, 'Gra': 1.0, 'Ice': 1.0, 'Fig': 2.0, 'Poi': 1.0, 'Gro': 1.0}",Analytic; Keen Eye; Run Away,https://pokemondb.net/ability/analytic; https://pokemondb.net/ability/keen-eye; https://pokemondb.net/ability/run-away,"Boosts move power when the Pokémon moves last.; Keen Eye prevents the Pokémon from losing accuracy, for example from moves like Sand-Attack . If a Pokémon with Keen Eye is the leading party Pokémon, wild Pokémon are 50% less likely to be lower level.; Run Away allows the bearer to flee a battle with a wild Pokémon without fail, even if the opposing Pokémon has used a move like Mean Look or Bind , or has an ability such as Arena Trap . Pokémon with Run Away cannot switch out for another Pokémon, only flee. It does not allow the Pokémon to flee from Trainer battles.",505,None,None,Watchog,https://pokemondb.net/pokedex/watchog
503,https://pokemondb.net/pokedex/samurott,Samurott,Water,94.6,150.0,"{'Nor': 1.0, 'Fir': 0.5, 'Wat': 0.5, 'Ele': 2.0, 'Gra': 2.0, 'Ice': 0.5, 'Fig': 1.0, 'Poi': 1.0, 'Gro': 1.0}",Shell Armor; Torrent,https://pokemondb.net/ability/shell-armor; https://pokemondb.net/ability/torrent,Shell Armor prevents the Pokémon from receiving a critical hit.; Torrent increases the power of Water -type moves by 50% (1.5×) when the ability-bearer's HP falls below a third of its maximum (known in-game as in a pinch ).,None,None,None,None,None
505,https://pokemondb.net/pokedex/watchog,Watchog,Normal,27.0,110.0,"{'Nor': 1.0, 'Fir': 1.0, 'Wat': 1.0, 'Ele': 1.0, 'Gra': 1.0, 'Ice': 1.0, 'Fig': 2.0, 'Poi': 1.0, 'Gro': 1.0}",Analytic; Keen Eye; Illuminate,https://pokemondb.net/ability/analytic; https://pokemondb.net/ability/keen-eye; https://pokemondb.net/ability/illuminate,"Boosts move power when the Pokémon moves last.; Keen Eye prevents the Pokémon from losing accuracy, for example from moves like Sand-Attack . If a Pokémon with Keen Eye is the leading party Pokémon, wild Pokémon are 50% less likely to be lower level.; Illuminate has no effect in battle. If a Pokémon with Illuminate is the leading party Pokémon, wild Pokémon are twice as likely to appear.",None,None,None,None,None
506,https://pokemondb.net/pokedex/lillipup,Lillipup,Normal,4.1,40.0,"{'Nor': 1.0, 'Fir': 1.0, 'Wat': 1.0, 'Ele': 1.0, 'Gra': 1.0, 'Ice': 1.0, 'Fig': 2.0, 'Poi': 1.0, 'Gro': 1.0}",Run Away; Pickup; Vital Spirit,https://pokemondb.net/ability/run-away; https://pokemondb.net/ability/pickup; https://pokemondb.net/ability/vital-spirit,"Run Away allows the bearer to flee a battle with a wild Pokémon without fail, even if the opposing Pokémon has used a move like Mean Look or Bind , or has an ability such as Arena Trap . Pokémon with Run Away cannot switch out for another Pokémon, only flee. It does not allow the Pokémon to flee from Trainer battles.; When another Pokémon on the field uses a single-use held item, a Pokémon with Pickup will obtain the used item (if they are not already holding anything) and it can be used again. Pokémon with Pickup will also obtain an item thrown at them with Fling (if they are not already holding anything). In Generations 3-4 , Pickup has no effect in battle. When a battle ends, any party Pokémon with Pickup has a 10% chance of picking up an item (if they are not already holding an item). Items picked up range from Potions, Great Balls, Ultra Balls and Rare Candies up to Leftovers and some TMs. Better items have a lower chance of being found; furthermore, higher-level Pokémon will obtain better items.; Vital Spirit prevents the ability-bearer from falling asleep. This means that it also prevents the use of the move Rest . If a Pokémon with Vital Spirit is the leading party Pokémon, wild Pokémon are 50% more likely to be higher level.",507; 508,32; None,None; None,Herdier; Stoutland,https://pokemondb.net/pokedex/herdier; https://pokemondb.net/pokedex/stoutland
507,https://pokemondb.net/pokedex/herdier,Herdier,Normal,14.7,90.0,"{'Nor': 1.0, 'Fir': 1.0, 'Wat': 1.0, 'Ele': 1.0, 'Gra': 1.0, 'Ice': 1.0, 'Fig': 2.0, 'Poi': 1.0, 'Gro': 1.0}",Scrappy; Sand Rush; Intimidate,https://pokemondb.net/ability/scrappy; https://pokemondb.net/ability/sand-rush; https://pokemondb.net/ability/intimidate,"Enables moves to hit Ghost-type Pokémon.; Sand Rush doubles the ability-bearer's Speed during a sandstorm .; Intimidate lower's the Attack of all opponents by one stage when the ability-bearer switches in (including the start of a battle). Stats can be lowered to a minimum of -6 stages each. If a Pokémon with Intimidate is the leading party Pokémon, wild Pokémon are 50% less likely to be lower level.",508,None,None,Stoutland,https://pokemondb.net/pokedex/stoutland
508,https://pokemondb.net/pokedex/stoutland,Stoutland,Normal,61.0,120.0,"{'Nor': 1.0, 'Fir': 1.0, 'Wat': 1.0, 'Ele': 1.0, 'Gra': 1.0, 'Ice': 1.0, 'Fig': 2.0, 'Poi': 1.0, 'Gro': 1.0}",Scrappy; Sand Rush; Intimidate,https://pokemondb.net/ability/scrappy; https://pokemondb.net/ability/sand-rush; https://pokemondb.net/ability/intimidate,"Enables moves to hit Ghost-type Pokémon.; Sand Rush doubles the ability-bearer's Speed during a sandstorm .; Intimidate lower's the Attack of all opponents by one stage when the ability-bearer switches in (including the start of a battle). Stats can be lowered to a minimum of -6 stages each. If a Pokémon with Intimidate is the leading party Pokémon, wild Pokémon are 50% less likely to be lower level.",None,None,None,None,None
509,https://pokemondb.net/pokedex/purrloin,Purrloin,Dark,10.1,40.0,"{'Nor': 1.0, 'Fir': 1.0, 'Wat': 1.0, 'Ele': 1.0, 'Gra': 1.0, 'Ice': 1.0, 'Fig': 2.0, 'Poi': 1.0, 'Gro': 1.0}",Prankster; Unburden; Limber,https://pokemondb.net/ability/prankster; https://pokemondb.net/ability/unburden; https://pokemondb.net/ability/limber,"Prankster increases the priority of status moves by +1. This means that a slower Pokémon with Prankster can use a status move before the opponent uses a regular move. Or if the ability-bearer is faster, it could use a status move before the opponent uses a priority move like Aqua Jet . The move Quick Guard does not block moves whose priority is increased by Prankster (but it does block moves that already have increased priority).; Raises Speed if a held item is used.; The Pokémon is protected from paralysis.",510,None,None,Liepard,https://pokemondb.net/pokedex/liepard
510,https://pokemondb.net/pokedex/liepard,Liepard,Dark,37.5,110.0,"{'Nor': 1.0, 'Fir': 1.0, 'Wat': 1.0, 'Ele': 1.0, 'Gra': 1.0, 'Ice': 1.0, 'Fig': 2.0, 'Poi': 1.0, 'Gro': 1.0}",Prankster; Unburden; Limber,https://pokemondb.net/ability/prankster; https://pokemondb.net/ability/unburden; https://pokemondb.net/ability/limber,"Prankster increases the priority of status moves by +1. This means that a slower Pokémon with Prankster can use a status move before the opponent uses a regular move. Or if the ability-bearer is faster, it could use a status move before the opponent uses a priority move like Aqua Jet . The move Quick Guard does not block moves whose priority is increased by Prankster (but it does block moves that already have increased priority).; Raises Speed if a held item is used.; The Pokémon is protected from paralysis.",None,None,None,None,None
512,https://pokemondb.net/pokedex/simisage,Simisage,Grass,30.5,110.0,"{'Nor': 1.0, 'Fir': 2.0, 'Wat': 0.5, 'Ele': 0.5, 'Gra': 0.5, 'Ice': 2.0, 'Fig': 1.0, 'Poi': 2.0, 'Gro': 0.5}",Overgrow; Gluttony,https://pokemondb.net/ability/overgrow; https://pokemondb.net/ability/gluttony,"Overgrow increases the power of Grass -type moves by 50% (1.5×) when the ability-bearer's HP falls below a third of its maximum (known in-game as in a pinch ).; A Pokémon with Gluttony will use a pinch berry when its HP drops to 50%, rather than the usual 25%. Pinch berries are: Figy, Wiki, Mago, Aguav, Iapapa, Liechi, Ganlon, Salac, Petaya, Apicot, Lansat, Starf, Micle and Custap. (Their descriptions state that they work in a pinch. )",None,None,None,None,None
513,https://pokemondb.net/pokedex/pansear,Pansear,Fire,11.0,60.0,"{'Nor': 1.0, 'Fir': 0.5, 'Wat': 2.0, 'Ele': 1.0, 'Gra': 0.5, 'Ice': 0.5, 'Fig': 1.0, 'Poi': 1.0, 'Gro': 2.0}",Blaze; Gluttony,https://pokemondb.net/ability/blaze; https://pokemondb.net/ability/gluttony,"Blaze increases the power of Fire -type moves by 50% (1.5×) when the ability-bearer's HP falls below a third of its maximum (known in-game as in a pinch ).; A Pokémon with Gluttony will use a pinch berry when its HP drops to 50%, rather than the usual 25%. Pinch berries are: Figy, Wiki, Mago, Aguav, Iapapa, Liechi, Ganlon, Salac, Petaya, Apicot, Lansat, Starf, Micle and Custap. (Their descriptions state that they work in a pinch. )",514,None,None,Simisear,https://pokemondb.net/pokedex/simisear
514,https://pokemondb.net/pokedex/simisear,Simisear,Fire,28.0,100.0,"{'Nor': 1.0, 'Fir': 0.5, 'Wat': 2.0, 'Ele': 1.0, 'Gra': 0.5, 'Ice': 0.5, 'Fig': 1.0, 'Poi': 1.0, 'Gro': 2.0}",Blaze; Gluttony,https://pokemondb.net/ability/blaze; https://pokemondb.net/ability/gluttony,"Blaze increases the power of Fire -type moves by 50% (1.5×) when the ability-bearer's HP falls below a third of its maximum (known in-game as in a pinch ).; A Pokémon with Gluttony will use a pinch berry when its HP drops to 50%, rather than the usual 25%. Pinch berries are: Figy, Wiki, Mago, Aguav, Iapapa, Liechi, Ganlon, Salac, Petaya, Apicot, Lansat, Starf, Micle and Custap. (Their descriptions state that they work in a pinch. )",None,None,None,None,None
515,https://pokemondb.net/pokedex/panpour,Panpour,Water,13.5,60.0,"{'Nor': 1.0, 'Fir': 0.5, 'Wat': 0.5, 'Ele': 2.0, 'Gra': 2.0, 'Ice': 0.5, 'Fig': 1.0, 'Poi': 1.0, 'Gro': 1.0}",Torrent; Gluttony,https://pokemondb.net/ability/torrent; https://pokemondb.net/ability/gluttony,"Torrent increases the power of Water -type moves by 50% (1.5×) when the ability-bearer's HP falls below a third of its maximum (known in-game as in a pinch ).; A Pokémon with Gluttony will use a pinch berry when its HP drops to 50%, rather than the usual 25%. Pinch berries are: Figy, Wiki, Mago, Aguav, Iapapa, Liechi, Ganlon, Salac, Petaya, Apicot, Lansat, Starf, Micle and Custap. (Their descriptions state that they work in a pinch. )",516,None,None,Simipour,https://pokemondb.net/pokedex/simipour
516,https://pokemondb.net/pokedex/simipour,Simipour,Water,29.0,100.0,"{'Nor': 1.0, 'Fir': 0.5, 'Wat': 0.5, 'Ele': 2.0, 'Gra': 2.0, 'Ice': 0.5, 'Fig': 1.0, 'Poi': 1.0, 'Gro': 1.0}",Torrent; Gluttony,https://pokemondb.net/ability/torrent; https://pokemondb.net/ability/gluttony,"Torrent increases the power of Water -type moves by 50% (1.5×) when the ability-bearer's HP falls below a third of its maximum (known in-game as in a pinch ).; A Pokémon with Gluttony will use a pinch berry when its HP drops to 50%, rather than the usual 25%. Pinch berries are: Figy, Wiki, Mago, Aguav, Iapapa, Liechi, Ganlon, Salac, Petaya, Apicot, Lansat, Starf, Micle and Custap. (Their descriptions state that they work in a pinch. )",None,None,None,None,None
517,https://pokemondb.net/pokedex/munna,Munna,Psychic,23.3,60.0,"{'Nor': 1.0, 'Fir': 1.0, 'Wat': 1.0, 'Ele': 1.0, 'Gra': 1.0, 'Ice': 1.0, 'Fig': 0.5, 'Poi': 1.0, 'Gro': 1.0}",Telepathy; Synchronize; Forewarn,https://pokemondb.net/ability/telepathy; https://pokemondb.net/ability/synchronize; https://pokemondb.net/ability/forewarn,"Pokémon with the Telepathy ability will not take damage from teammates in double and triple battles. This affects moves such as Surf and Earthquake , which normally hit all Pokémon on the field apart from the user.; If the opponent causes a burn, paralysis, or poisoning of a Pokémon with Synchronize , the opponent receives the status condition too. Self-inflicted status conditions (for example through the use of an item) are not passed on. In Generations 3-4 , bad poison is only passed on as regular poison. If a Pokémon with Synchronize is the leading party Pokémon, there is a 50% chance of each wild Pokémon encountered having the same nature.; Determines what moves a foe has.",518,None,None,Musharna,https://pokemondb.net/pokedex/musharna
518,https://pokemondb.net/pokedex/musharna,Musharna,Psychic,60.5,110.0,"{'Nor': 1.0, 'Fir': 1.0, 'Wat': 1.0, 'Ele': 1.0, 'Gra': 1.0, 'Ice': 1.0, 'Fig': 0.5, 'Poi': 1.0, 'Gro': 1.0}",Telepathy; Synchronize; Forewarn,https://pokemondb.net/ability/telepathy; https://pokemondb.net/ability/synchronize; https://pokemondb.net/ability/forewarn,"Pokémon with the Telepathy ability will not take damage from teammates in double and triple battles. This affects moves such as Surf and Earthquake , which normally hit all Pokémon on the field apart from the user.; If the opponent causes a burn, paralysis, or poisoning of a Pokémon with Synchronize , the opponent receives the status condition too. Self-inflicted status conditions (for example through the use of an item) are not passed on. In Generations 3-4 , bad poison is only passed on as regular poison. If a Pokémon with Synchronize is the leading party Pokémon, there is a 50% chance of each wild Pokémon encountered having the same nature.; Determines what moves a foe has.",None,None,None,None,None
519,https://pokemondb.net/pokedex/pidove,Pidove,"Normal, Flying",2.1,30.0,"{'Nor': 1.0, 'Fir': 1.0, 'Wat': 1.0, 'Ele': 2.0, 'Gra': 0.5, 'Ice': 2.0, 'Fig': 1.0, 'Poi': 1.0, 'Gro': 0.0}",Rivalry; Super Luck; Big Pecks,https://pokemondb.net/ability/rivalry; https://pokemondb.net/ability/super-luck; https://pokemondb.net/ability/big-pecks,"Deals more damage to a Pokémon of same gender.; Super Luck raises the ability-bearer's critical-hit ratio by one stage (for most moves this increases from a 1 ⁄ 16 chance to 1 ⁄ 8 ).; Big Pecks prevents the ability-bearer's Defense stat from being lowered, for example via Tail Whip .",520; 521,32; None,None; None,Tranquill; Unfezant,https://pokemondb.net/pokedex/tranquill; https://pokemondb.net/pokedex/unfezant
494,https://pokemondb.net/pokedex/victini,Victini,"Psychic, Fire",4.0,40.0,"{'Nor': 1.0, 'Fir': 0.5, 'Wat': 2.0, 'Ele': 1.0, 'Gra': 0.5, 'Ice': 0.5, 'Fig': 0.5, 'Poi': 1.0, 'Gro': 2.0}",Victory Star,https://pokemondb.net/ability/victory-star,Boosts the accuracy of its allies and itself.,None,None,None,None,None
493,https://pokemondb.net/pokedex/arceus,Arceus,Normal,320.0,320.0,"{'Nor': 1.0, 'Fir': 1.0, 'Wat': 1.0, 'Ele': 1.0, 'Gra': 1.0, 'Ice': 1.0, 'Fig': 2.0, 'Poi': 1.0, 'Gro': 1.0}",Multitype,https://pokemondb.net/ability/multitype,"Multitype changes the ability-bearer's type if it is holding one of the Type Plate items. Moves of the corresponding type receive STAB . The moves Gastro Acid , Role Play , Skill Swap , Worry Seed or the ability Trace do not affect a Pokémon with Multitype . The moves Covet , Knock Off , Switcheroo and Thief cannot remove Plates from a Pokémon with Multitype , but they can remove any other item. The Plates are: In Generation 4 the moves Covet , Knock Off , Switcheroo and Thief (all of which remove items) do not affect Pokémon with Multitype .",None,None,None,None,None
492,https://pokemondb.net/pokedex/shaymin,Shaymin,Grass,2.1,20.0,"{'Nor': 1.0, 'Fir': 2.0, 'Wat': 0.5, 'Ele': 0.5, 'Gra': 0.5, 'Ice': 2.0, 'Fig': 1.0, 'Poi': 2.0, 'Gro': 0.5}",Natural Cure,https://pokemondb.net/ability/natural-cure,All status problems heal when it switches out.,None,None,None,None,None
491,https://pokemondb.net/pokedex/darkrai,Darkrai,Dark,50.5,150.0,"{'Nor': 1.0, 'Fir': 1.0, 'Wat': 1.0, 'Ele': 1.0, 'Gra': 1.0, 'Ice': 1.0, 'Fig': 2.0, 'Poi': 1.0, 'Gro': 1.0}",Bad Dreams,https://pokemondb.net/ability/bad-dreams,Bad Dreams causes all sleeping opponents to lose 1 ⁄ 8 of their maximum HP at the end of each turn.,None,None,None,None,None
490,https://pokemondb.net/pokedex/manaphy,Manaphy,Water,1.4,30.0,"{'Nor': 1.0, 'Fir': 0.5, 'Wat': 0.5, 'Ele': 2.0, 'Gra': 2.0, 'Ice': 0.5, 'Fig': 1.0, 'Poi': 1.0, 'Gro': 1.0}",Hydration,https://pokemondb.net/ability/hydration,"A Pokémon with Hydration will cure itself of any status conditions during rain, at the end of each turn. This includes self-inflicted conditions such as from using Rest .",None,None,None,None,None
489,https://pokemondb.net/pokedex/phione,Phione,Water,3.1,40.0,"{'Nor': 1.0, 'Fir': 0.5, 'Wat': 0.5, 'Ele': 2.0, 'Gra': 2.0, 'Ice': 0.5, 'Fig': 1.0, 'Poi': 1.0, 'Gro': 1.0}",Hydration,https://pokemondb.net/ability/hydration,"A Pokémon with Hydration will cure itself of any status conditions during rain, at the end of each turn. This includes self-inflicted conditions such as from using Rest .",None,None,None,None,None
488,https://pokemondb.net/pokedex/cresselia,Cresselia,Psychic,85.6,150.0,"{'Nor': 1.0, 'Fir': 1.0, 'Wat': 1.0, 'Ele': 1.0, 'Gra': 1.0, 'Ice': 1.0, 'Fig': 0.5, 'Poi': 1.0, 'Gro': 0.0}",Levitate,https://pokemondb.net/ability/levitate,"Levitate causes the Pokémon to be raised (like Flying -type Pokémon). Raised Pokémon are not affected by Ground -type moves, Spikes , Toxic Spikes nor Arena Trap . Full details in glossary .",None,None,None,None,None
495,https://pokemondb.net/pokedex/snivy,Snivy,Grass,8.1,60.0,"{'Nor': 1.0, 'Fir': 2.0, 'Wat': 0.5, 'Ele': 0.5, 'Gra': 0.5, 'Ice': 2.0, 'Fig': 1.0, 'Poi': 2.0, 'Gro': 0.5}",Contrary; Overgrow,https://pokemondb.net/ability/contrary; https://pokemondb.net/ability/overgrow,Makes stat changes have an opposite effect.; Overgrow increases the power of Grass -type moves by 50% (1.5×) when the ability-bearer's HP falls below a third of its maximum (known in-game as in a pinch ).,496; 497,36; None,None; None,Servine; Serperior,https://pokemondb.net/pokedex/servine; https://pokemondb.net/pokedex/serperior
496,https://pokemondb.net/pokedex/servine,Servine,Grass,16.0,80.0,"{'Nor': 1.0, 'Fir': 2.0, 'Wat': 0.5, 'Ele': 0.5, 'Gra': 0.5, 'Ice': 2.0, 'Fig': 1.0, 'Poi': 2.0, 'Gro': 0.5}",Contrary; Overgrow,https://pokemondb.net/ability/contrary; https://pokemondb.net/ability/overgrow,Makes stat changes have an opposite effect.; Overgrow increases the power of Grass -type moves by 50% (1.5×) when the ability-bearer's HP falls below a third of its maximum (known in-game as in a pinch ).,497,None,None,Serperior,https://pokemondb.net/pokedex/serperior
497,https://pokemondb.net/pokedex/serperior,Serperior,Grass,63.0,330.0,"{'Nor': 1.0, 'Fir': 2.0, 'Wat': 0.5, 'Ele': 0.5, 'Gra': 0.5, 'Ice': 2.0, 'Fig': 1.0, 'Poi': 2.0, 'Gro': 0.5}",Contrary; Overgrow,https://pokemondb.net/ability/contrary; https://pokemondb.net/ability/overgrow,Makes stat changes have an opposite effect.; Overgrow increases the power of Grass -type moves by 50% (1.5×) when the ability-bearer's HP falls below a third of its maximum (known in-game as in a pinch ).,None,None,None,None,None
498,https://pokemondb.net/pokedex/tepig,Tepig,Fire,9.9,50.0,"{'Nor': 1.0, 'Fir': 0.5, 'Wat': 2.0, 'Ele': 1.0, 'Gra': 0.5, 'Ice': 0.5, 'Fig': 1.0, 'Poi': 1.0, 'Gro': 2.0}",Thick Fat; Blaze,https://pokemondb.net/ability/thick-fat; https://pokemondb.net/ability/blaze,"Thick Fat reduces the damage taken from Fire -type and Ice -type moves by 50%. Interestingly, many Pokémon possessing this ability already take reduced damage from those types. A Dewgong or Walrein with Thick Fat would take 1 ⁄ 8 normal damage when hit by an Ice-type move.; Blaze increases the power of Fire -type moves by 50% (1.5×) when the ability-bearer's HP falls below a third of its maximum (known in-game as in a pinch ).",499; 500,36; None,None; None,Pignite; Emboar,https://pokemondb.net/pokedex/pignite; https://pokemondb.net/pokedex/emboar
499,https://pokemondb.net/pokedex/pignite,Pignite,"Fire, Fighting",55.5,100.0,"{'Nor': 1.0, 'Fir': 0.5, 'Wat': 2.0, 'Ele': 1.0, 'Gra': 0.5, 'Ice': 0.5, 'Fig': 1.0, 'Poi': 1.0, 'Gro': 2.0}",Thick Fat; Blaze,https://pokemondb.net/ability/thick-fat; https://pokemondb.net/ability/blaze,"Thick Fat reduces the damage taken from Fire -type and Ice -type moves by 50%. Interestingly, many Pokémon possessing this ability already take reduced damage from those types. A Dewgong or Walrein with Thick Fat would take 1 ⁄ 8 normal damage when hit by an Ice-type move.; Blaze increases the power of Fire -type moves by 50% (1.5×) when the ability-bearer's HP falls below a third of its maximum (known in-game as in a pinch ).",500,None,None,Emboar,https://pokemondb.net/pokedex/emboar
500,https://pokemondb.net/pokedex/emboar,Emboar,"Fire, Fighting",150.0,160.0,"{'Nor': 1.0, 'Fir': 0.5, 'Wat': 2.0, 'Ele': 1.0, 'Gra': 0.5, 'Ice': 0.5, 'Fig': 1.0, 'Poi': 1.0, 'Gro': 2.0}",Reckless; Blaze,https://pokemondb.net/ability/reckless; https://pokemondb.net/ability/blaze,"Reckless increases the power of recoil moves by 20%. By extension, this means the amount of recoil damage taken will increase as more damage is dealt (except for High Jump Kick and Jump Kick which are based on the user's HP). The attacks classed as punching moves are shown below with their normal and boosted power: * No Pokémon with Reckless can learn these moves.; Blaze increases the power of Fire -type moves by 50% (1.5×) when the ability-bearer's HP falls below a third of its maximum (known in-game as in a pinch ).",None,None,None,None,None
501,https://pokemondb.net/pokedex/oshawott,Oshawott,Water,5.9,50.0,"{'Nor': 1.0, 'Fir': 0.5, 'Wat': 0.5, 'Ele': 2.0, 'Gra': 2.0, 'Ice': 0.5, 'Fig': 1.0, 'Poi': 1.0, 'Gro': 1.0}",Shell Armor; Torrent,https://pokemondb.net/ability/shell-armor; https://pokemondb.net/ability/torrent,Shell Armor prevents the Pokémon from receiving a critical hit.; Torrent increases the power of Water -type moves by 50% (1.5×) when the ability-bearer's HP falls below a third of its maximum (known in-game as in a pinch ).,502; 503; 503,36; 36; 36,None; None; None,Dewott; None; None,https://pokemondb.net/pokedex/dewott; None; None
502,https://pokemondb.net/pokedex/dewott,Dewott,Water,24.5,80.0,"{'Nor': 1.0, 'Fir': 0.5, 'Wat': 0.5, 'Ele': 2.0, 'Gra': 2.0, 'Ice': 0.5, 'Fig': 1.0, 'Poi': 1.0, 'Gro': 1.0}",Shell Armor; Torrent,https://pokemondb.net/ability/shell-armor; https://pokemondb.net/ability/torrent,Shell Armor prevents the Pokémon from receiving a critical hit.; Torrent increases the power of Water -type moves by 50% (1.5×) when the ability-bearer's HP falls below a third of its maximum (known in-game as in a pinch ).,503; 503,36; 36,None; None,None; None,None; None
486,https://pokemondb.net/pokedex/regigigas,Regigigas,Normal,420.0,370.0,"{'Nor': 1.0, 'Fir': 1.0, 'Wat': 1.0, 'Ele': 1.0, 'Gra': 1.0, 'Ice': 1.0, 'Fig': 2.0, 'Poi': 1.0, 'Gro': 1.0}",Slow Start,https://pokemondb.net/ability/slow-start,Temporarily halves Attack and Speed.,None,None,None,None,None
482,https://pokemondb.net/pokedex/azelf,Azelf,Psychic,0.3,30.0,"{'Nor': 1.0, 'Fir': 1.0, 'Wat': 1.0, 'Ele': 1.0, 'Gra': 1.0, 'Ice': 1.0, 'Fig': 0.5, 'Poi': 1.0, 'Gro': 0.0}",Levitate,https://pokemondb.net/ability/levitate,"Levitate causes the Pokémon to be raised (like Flying -type Pokémon). Raised Pokémon are not affected by Ground -type moves, Spikes , Toxic Spikes nor Arena Trap . Full details in glossary .",None,None,None,None,None
481,https://pokemondb.net/pokedex/mesprit,Mesprit,Psychic,0.3,30.0,"{'Nor': 1.0, 'Fir': 1.0, 'Wat': 1.0, 'Ele': 1.0, 'Gra': 1.0, 'Ice': 1.0, 'Fig': 0.5, 'Poi': 1.0, 'Gro': 0.0}",Levitate,https://pokemondb.net/ability/levitate,"Levitate causes the Pokémon to be raised (like Flying -type Pokémon). Raised Pokémon are not affected by Ground -type moves, Spikes , Toxic Spikes nor Arena Trap . Full details in glossary .",None,None,None,None,None
480,https://pokemondb.net/pokedex/uxie,Uxie,Psychic,0.3,30.0,"{'Nor': 1.0, 'Fir': 1.0, 'Wat': 1.0, 'Ele': 1.0, 'Gra': 1.0, 'Ice': 1.0, 'Fig': 0.5, 'Poi': 1.0, 'Gro': 0.0}",Levitate,https://pokemondb.net/ability/levitate,"Levitate causes the Pokémon to be raised (like Flying -type Pokémon). Raised Pokémon are not affected by Ground -type moves, Spikes , Toxic Spikes nor Arena Trap . Full details in glossary .",None,None,None,None,None
