numero,url,nome,tipos,Peso_kg,altura_cm,efetividade_dict,habilidades_nomes,habilidades_urls,habilidades_descricoes,numero_evol,level_evol,item_evol,nome_evol,url_evol
1025,https://pokemondb.net/pokedex/pecharunt,Pecharunt,"Poison, Ghost",0.3,30.0,"{'Nor': 0.0, 'Fir': 1.0, 'Wat': 1.0, 'Ele': 1.0, 'Gra': 0.5, 'Ice': 1.0, 'Fig': 0.0, 'Poi': 0.25, 'Gro': 2.0}",,,,None,None,None,None,None
47,https://pokemondb.net/pokedex/parasect,Parasect,"Bug, Grass",29.5,100.0,"{'Nor': 1.0, 'Fir': 4.0, 'Wat': 0.5, 'Ele': 0.5, 'Gra': 0.25, 'Ice': 2.0, 'Fig': 0.5, 'Poi': 2.0, 'Gro': 0.25}",Damp; Dry Skin; Effect Spore,https://pokemondb.net/ability/damp; https://pokemondb.net/ability/dry-skin; https://pokemondb.net/ability/effect-spore,Damp prevents all Pokémon on the field from using the moves Selfdestruct and Explosion . It also prevents damage (to the Damp Pokémon only) from the ability Aftermath .; Dry Skin causes several effects:; Contact may poison or cause paralysis or sleep.,None,None,None,None,None
48,https://pokemondb.net/pokedex/venonat,Venonat,"Bug, Poison",30.0,100.0,"{'Nor': 1.0, 'Fir': 2.0, 'Wat': 1.0, 'Ele': 1.0, 'Gra': 0.25, 'Ice': 1.0, 'Fig': 0.25, 'Poi': 0.5, 'Gro': 1.0}",Run Away; Tinted Lens; Compound Eyes,https://pokemondb.net/ability/run-away; https://pokemondb.net/ability/tinted-lens; https://pokemondb.net/ability/compound-eyes,"Run Away allows the bearer to flee a battle with a wild Pokémon without fail, even if the opposing Pokémon has used a move like Mean Look or Bind , or has an ability such as Arena Trap . Pokémon with Run Away cannot switch out for another Pokémon, only flee. It does not allow the Pokémon to flee from Trainer battles.; Powers up ""not very effective"" moves.; Compound Eyes raises the ability-bearer's accuracy by 30%. In Generations 3-5 , this ability's name was formatted as Compoundeyes . If a Pokémon with Compound Eyes is first in the party, Pokémon that can be holding items have that chance increase from 50% to 60% (for common items), 5% to 20% (for uncommon items) or 1% to 5% (for rare items).",49,None,None,Venomoth,https://pokemondb.net/pokedex/venomoth
49,https://pokemondb.net/pokedex/venomoth,Venomoth,"Bug, Poison",12.5,150.0,"{'Nor': 1.0, 'Fir': 2.0, 'Wat': 1.0, 'Ele': 1.0, 'Gra': 0.25, 'Ice': 1.0, 'Fig': 0.25, 'Poi': 0.5, 'Gro': 1.0}",Wonder Skin; Tinted Lens; Shield Dust,https://pokemondb.net/ability/wonder-skin; https://pokemondb.net/ability/tinted-lens; https://pokemondb.net/ability/shield-dust,"Wonder Skin halves the accuracy of all status moves targeted at the ability-bearer. It does not affect self-inflicted status moves like Reflect or Swords Dance , nor does it affect the secondary conditions of attacking moves like Flamethrower .; Powers up ""not very effective"" moves.; Blocks the added effects of attacks taken.",None,None,None,None,None
50,https://pokemondb.net/pokedex/diglett,Diglett,Ground,0.8,20.0,"{'Nor': 1.0, 'Fir': 1.0, 'Wat': 2.0, 'Ele': 0.0, 'Gra': 2.0, 'Ice': 2.0, 'Fig': 1.0, 'Poi': 0.5, 'Gro': 1.0}",Sand Force; Arena Trap; Sand Veil,https://pokemondb.net/ability/sand-force; https://pokemondb.net/ability/arena-trap; https://pokemondb.net/ability/sand-veil,"Sand Force raises the power of Ground , Rock and Steel type moves by 30% during a sandstorm . It also grants immunity to the sandstorm damage, if not already immune (currently this only applies to Shellos since all other Pokémon with the ability are already immune).; Arena Trap prevents opponents from fleeing or switching out. Raised Pokémon are not affected. Raised Pokémon are any Flying types or those under the effects of Levitate , Magnet Rise or Telekinesis . Full details in glossary . If a Pokémon with Arena Trap is the leading party Pokémon, wild Pokémon are twice as likely to appear.; Sand Veil raises the ability-bearer's evasion by 20% in a sandstorm . It also gives immunity to sandstorm damage (if they are not already protected by being Ground / Rock / Steel type). If a Pokémon with Sand Veil is the leading party Pokémon while travelling in a sandstorm, wild Pokémon are only half as likely to appear.",51; 51,None; 26,None; None,Dugtrio; None,https://pokemondb.net/pokedex/dugtrio; None
51,https://pokemondb.net/pokedex/dugtrio,Dugtrio,Ground,33.3,70.0,"{'Nor': 1.0, 'Fir': 1.0, 'Wat': 2.0, 'Ele': 0.0, 'Gra': 2.0, 'Ice': 2.0, 'Fig': 1.0, 'Poi': 0.5, 'Gro': 1.0}",Sand Force; Arena Trap; Sand Veil,https://pokemondb.net/ability/sand-force; https://pokemondb.net/ability/arena-trap; https://pokemondb.net/ability/sand-veil,"Sand Force raises the power of Ground , Rock and Steel type moves by 30% during a sandstorm . It also grants immunity to the sandstorm damage, if not already immune (currently this only applies to Shellos since all other Pokémon with the ability are already immune).; Arena Trap prevents opponents from fleeing or switching out. Raised Pokémon are not affected. Raised Pokémon are any Flying types or those under the effects of Levitate , Magnet Rise or Telekinesis . Full details in glossary . If a Pokémon with Arena Trap is the leading party Pokémon, wild Pokémon are twice as likely to appear.; Sand Veil raises the ability-bearer's evasion by 20% in a sandstorm . It also gives immunity to sandstorm damage (if they are not already protected by being Ground / Rock / Steel type). If a Pokémon with Sand Veil is the leading party Pokémon while travelling in a sandstorm, wild Pokémon are only half as likely to appear.",51,26,None,None,None
52,https://pokemondb.net/pokedex/meowth,Meowth,Normal,4.2,40.0,"{'Nor': 1.0, 'Fir': 1.0, 'Wat': 1.0, 'Ele': 1.0, 'Gra': 1.0, 'Ice': 1.0, 'Fig': 2.0, 'Poi': 1.0, 'Gro': 1.0}",Unnerve; Technician; Pickup,https://pokemondb.net/ability/unnerve; https://pokemondb.net/ability/technician; https://pokemondb.net/ability/pickup,"Makes the foe nervous and unable to eat Berries.; Technician increases the power of moves - that are usually base power 60 or below - by 50%. Moves with variable base power are boosted only when it is 60 or below. For example, if Magnitude hits at level 6 it will be boosted from 50 to 75, but level 7 will stay at 70 base power. Moves like Sonic Boom that deal fixed HP damage are not affected by Technician .; When another Pokémon on the field uses a single-use held item, a Pokémon with Pickup will obtain the used item (if they are not already holding anything) and it can be used again. Pokémon with Pickup will also obtain an item thrown at them with Fling (if they are not already holding anything). In Generations 3-4 , Pickup has no effect in battle. When a battle ends, any party Pokémon with Pickup has a 10% chance of picking up an item (if they are not already holding an item). Items picked up range from Potions, Great Balls, Ultra Balls and Rare Candies up to Leftovers and some TMs. Better items have a lower chance of being found; furthermore, higher-level Pokémon will obtain better items.",53; 53; 52; 863,None; None; 28; None,None; None; None; None,Persian; None; Meowth; Perrserker,https://pokemondb.net/pokedex/persian; None; https://pokemondb.net/pokedex/meowth; https://pokemondb.net/pokedex/perrserker
53,https://pokemondb.net/pokedex/persian,Persian,Normal,32.0,100.0,"{'Nor': 1.0, 'Fir': 1.0, 'Wat': 1.0, 'Ele': 1.0, 'Gra': 1.0, 'Ice': 1.0, 'Fig': 2.0, 'Poi': 1.0, 'Gro': 1.0}",Unnerve; Technician; Limber,https://pokemondb.net/ability/unnerve; https://pokemondb.net/ability/technician; https://pokemondb.net/ability/limber,"Makes the foe nervous and unable to eat Berries.; Technician increases the power of moves - that are usually base power 60 or below - by 50%. Moves with variable base power are boosted only when it is 60 or below. For example, if Magnitude hits at level 6 it will be boosted from 50 to 75, but level 7 will stay at 70 base power. Moves like Sonic Boom that deal fixed HP damage are not affected by Technician .; The Pokémon is protected from paralysis.",53; 52; 863,None; 28; None,None; None; None,None; Meowth; Perrserker,None; https://pokemondb.net/pokedex/meowth; https://pokemondb.net/pokedex/perrserker
54,https://pokemondb.net/pokedex/psyduck,Psyduck,Water,19.6,80.0,"{'Nor': 1.0, 'Fir': 0.5, 'Wat': 0.5, 'Ele': 2.0, 'Gra': 2.0, 'Ice': 0.5, 'Fig': 1.0, 'Poi': 1.0, 'Gro': 1.0}",Swift Swim; Cloud Nine; Damp,https://pokemondb.net/ability/swift-swim; https://pokemondb.net/ability/cloud-nine; https://pokemondb.net/ability/damp,"Swift Swim doubles the ability-bearer's Speed during rain .; Cloud Nine suppresses all effects brought on by weather, including move power increases, end-of-turn damage, accuracy changes, relevant abilities and so on.; Damp prevents all Pokémon on the field from using the moves Selfdestruct and Explosion . It also prevents damage (to the Damp Pokémon only) from the ability Aftermath .",55,None,None,Golduck,https://pokemondb.net/pokedex/golduck
55,https://pokemondb.net/pokedex/golduck,Golduck,Water,76.6,170.0,"{'Nor': 1.0, 'Fir': 0.5, 'Wat': 0.5, 'Ele': 2.0, 'Gra': 2.0, 'Ice': 0.5, 'Fig': 1.0, 'Poi': 1.0, 'Gro': 1.0}",Swift Swim; Cloud Nine; Damp,https://pokemondb.net/ability/swift-swim; https://pokemondb.net/ability/cloud-nine; https://pokemondb.net/ability/damp,"Swift Swim doubles the ability-bearer's Speed during rain .; Cloud Nine suppresses all effects brought on by weather, including move power increases, end-of-turn damage, accuracy changes, relevant abilities and so on.; Damp prevents all Pokémon on the field from using the moves Selfdestruct and Explosion . It also prevents damage (to the Damp Pokémon only) from the ability Aftermath .",None,None,None,None,None
56,https://pokemondb.net/pokedex/mankey,Mankey,Fighting,28.0,50.0,"{'Nor': 1.0, 'Fir': 1.0, 'Wat': 1.0, 'Ele': 1.0, 'Gra': 1.0, 'Ice': 1.0, 'Fig': 1.0, 'Poi': 1.0, 'Gro': 1.0}",Defiant; Anger Point; Vital Spirit,https://pokemondb.net/ability/defiant; https://pokemondb.net/ability/anger-point; https://pokemondb.net/ability/vital-spirit,"Defiant raises the ability-bearer's Attack by two stages when hit by a stat-lowering move. Stats can be raised to a maximum of +6 stages each.; Anger Point raises the ability-bearer's Attack to its maximum level - +6 stages or 4× usual power - when a move targeting it receives a critical hit.; Vital Spirit prevents the ability-bearer from falling asleep. This means that it also prevents the use of the move Rest . If a Pokémon with Vital Spirit is the leading party Pokémon, wild Pokémon are 50% more likely to be higher level.",57; 979,20; None,None; None,Primeape; Annihilape,https://pokemondb.net/pokedex/primeape; https://pokemondb.net/pokedex/annihilape
1,https://pokemondb.net/pokedex/bulbasaur,Bulbasaur,"Grass, Poison",6.9,70.0,"{'Nor': 1.0, 'Fir': 2.0, 'Wat': 0.5, 'Ele': 0.5, 'Gra': 0.25, 'Ice': 2.0, 'Fig': 0.5, 'Poi': 1.0, 'Gro': 1.0}",Chlorophyll; Overgrow,https://pokemondb.net/ability/chlorophyll; https://pokemondb.net/ability/overgrow,Chlorophyll doubles the ability-bearer's Speed during bright sunshine .; Overgrow increases the power of Grass -type moves by 50% (1.5×) when the ability-bearer's HP falls below a third of its maximum (known in-game as in a pinch ).,2; 3,32; None,None; None,Ivysaur; Venusaur,https://pokemondb.net/pokedex/ivysaur; https://pokemondb.net/pokedex/venusaur
1024,https://pokemondb.net/pokedex/terapagos,Terapagos,Normal,6.5,20.0,"{'Nor': 1.0, 'Fir': 1.0, 'Wat': 1.0, 'Ele': 1.0, 'Gra': 1.0, 'Ice': 1.0, 'Fig': 2.0, 'Poi': 1.0, 'Gro': 1.0}",Tera Shift,https://pokemondb.net/ability/tera-shift,"When the Pokémon enters a battle, it absorbs the energy around itself and transforms into its Terastal Form.",None,None,None,None,None
1023,https://pokemondb.net/pokedex/iron-crown,Iron Crown,"Steel, Psychic",156.0,160.0,"{'Nor': 0.5, 'Fir': 2.0, 'Wat': 1.0, 'Ele': 1.0, 'Gra': 0.5, 'Ice': 0.5, 'Fig': 1.0, 'Poi': 0.0, 'Gro': 2.0}",Quark Drive,https://pokemondb.net/ability/quark-drive,"Raises highest stat on Electric Terrain, or if holding Booster Energy.",None,None,None,None,None
1022,https://pokemondb.net/pokedex/iron-boulder,Iron Boulder,"Rock, Psychic",162.5,150.0,"{'Nor': 0.5, 'Fir': 0.5, 'Wat': 2.0, 'Ele': 1.0, 'Gra': 2.0, 'Ice': 1.0, 'Fig': 1.0, 'Poi': 0.5, 'Gro': 2.0}",Quark Drive,https://pokemondb.net/ability/quark-drive,"Raises highest stat on Electric Terrain, or if holding Booster Energy.",None,None,None,None,None
1021,https://pokemondb.net/pokedex/raging-bolt,Raging Bolt,"Electric, Dragon",480.0,520.0,"{'Nor': 1.0, 'Fir': 0.5, 'Wat': 0.5, 'Ele': 0.25, 'Gra': 0.5, 'Ice': 2.0, 'Fig': 1.0, 'Poi': 1.0, 'Gro': 2.0}",Protosynthesis,https://pokemondb.net/ability/protosynthesis,"Raises highest stat in harsh sunlight, or if holding Booster Energy.",None,None,None,None,None
1020,https://pokemondb.net/pokedex/gouging-fire,Gouging Fire,"Fire, Dragon",590.0,350.0,"{'Nor': 1.0, 'Fir': 0.25, 'Wat': 1.0, 'Ele': 0.5, 'Gra': 0.25, 'Ice': 1.0, 'Fig': 1.0, 'Poi': 1.0, 'Gro': 2.0}",Protosynthesis,https://pokemondb.net/ability/protosynthesis,"Raises highest stat in harsh sunlight, or if holding Booster Energy.",None,None,None,None,None
1013,https://pokemondb.net/pokedex/sinistcha,Sinistcha,"Grass, Ghost",2.2,20.0,"{'Nor': 0.0, 'Fir': 2.0, 'Wat': 0.5, 'Ele': 0.5, 'Gra': 0.5, 'Ice': 2.0, 'Fig': 0.0, 'Poi': 1.0, 'Gro': 0.5}",Heatproof; Hospitality,https://pokemondb.net/ability/heatproof; https://pokemondb.net/ability/hospitality,"Heatproof reduces the damage taken from Fire -type moves by 50%. It also halves the damage from a burn, from 1 ⁄ 8 to 1 ⁄ 16 of the Pokémon's maximum HP.; When the Pokémon enters a battle, it showers its ally with hospitality, restoring a small amount of the ally's HP.",None,None,None,None,None
1014,https://pokemondb.net/pokedex/okidogi,Okidogi,"Poison, Fighting",92.0,180.0,"{'Nor': 1.0, 'Fir': 1.0, 'Wat': 1.0, 'Ele': 1.0, 'Gra': 0.5, 'Ice': 1.0, 'Fig': 0.5, 'Poi': 0.5, 'Gro': 2.0}",Guard Dog; Toxic Chain,https://pokemondb.net/ability/guard-dog; https://pokemondb.net/ability/toxic-chain,"Boosts Attack if intimidated, and prevents being forced to switch out.; Toxic Chain may cause bad poisoning when the Pokémon hits an opponent with a move. Toxic Chain is a new ability available in the Scarlet/Violet DLC.",None,None,None,None,None
1015,https://pokemondb.net/pokedex/munkidori,Munkidori,"Poison, Psychic",12.2,100.0,"{'Nor': 1.0, 'Fir': 1.0, 'Wat': 1.0, 'Ele': 1.0, 'Gra': 0.5, 'Ice': 1.0, 'Fig': 0.25, 'Poi': 0.5, 'Gro': 2.0}",Frisk; Toxic Chain,https://pokemondb.net/ability/frisk; https://pokemondb.net/ability/toxic-chain,The Pokémon can check a foe's held item.; Toxic Chain may cause bad poisoning when the Pokémon hits an opponent with a move. Toxic Chain is a new ability available in the Scarlet/Violet DLC.,None,None,None,None,None
1016,https://pokemondb.net/pokedex/fezandipiti,Fezandipiti,"Poison, Fairy",30.1,140.0,"{'Nor': 1.0, 'Fir': 1.0, 'Wat': 1.0, 'Ele': 1.0, 'Gra': 0.5, 'Ice': 1.0, 'Fig': 0.25, 'Poi': 1.0, 'Gro': 2.0}",Technician; Toxic Chain,https://pokemondb.net/ability/technician; https://pokemondb.net/ability/toxic-chain,"Technician increases the power of moves - that are usually base power 60 or below - by 50%. Moves with variable base power are boosted only when it is 60 or below. For example, if Magnitude hits at level 6 it will be boosted from 50 to 75, but level 7 will stay at 70 base power. Moves like Sonic Boom that deal fixed HP damage are not affected by Technician .; Toxic Chain may cause bad poisoning when the Pokémon hits an opponent with a move. Toxic Chain is a new ability available in the Scarlet/Violet DLC.",None,None,None,None,None
1017,https://pokemondb.net/pokedex/ogerpon,Ogerpon,Grass,39.8,120.0,"{'Nor': 1.0, 'Fir': 2.0, 'Wat': 0.5, 'Ele': 0.5, 'Gra': 0.5, 'Ice': 2.0, 'Fig': 1.0, 'Poi': 2.0, 'Gro': 0.5}",Embody Aspect; Defiant,https://pokemondb.net/ability/embody-aspect; https://pokemondb.net/ability/defiant,"Embody Aspect boosts a particular stat, depending on the form of a Terastallized Ogerpon :; Defiant raises the ability-bearer's Attack by two stages when hit by a stat-lowering move. Stats can be raised to a maximum of +6 stages each.",None,None,None,None,None
1018,https://pokemondb.net/pokedex/archaludon,Archaludon,"Steel, Dragon",60.0,200.0,"{'Nor': 0.5, 'Fir': 1.0, 'Wat': 0.5, 'Ele': 0.5, 'Gra': 0.25, 'Ice': 1.0, 'Fig': 2.0, 'Poi': 0.0, 'Gro': 2.0}",Stalwart; Stamina; Sturdy,https://pokemondb.net/ability/stalwart; https://pokemondb.net/ability/stamina; https://pokemondb.net/ability/sturdy,"Ignores moves and abilities that draw in moves.; Stamina raises the bearer's Defense by one stage when it is attacked by any move. Stats can be raised to a maximum of +6 stages each.; Sturdy allows the Pokémon to survive with 1 HP if attacked at full HP with an attack that would otherwise knock it out. It also prevents One-Hit-KO moves ( Fissure , Horn Drill , Guillotine or Sheer Cold ). If Sturdy activates before the final hit of a multi-hit move (such as Fury Swipes ), the subsequent hit will still deal damage and therefore cause the Pokémon to faint. Sturdy does not prevent self-inflicted KO moves such as Selfdestruct , Explosion and Final Gambit .",None,None,None,None,None
1019,https://pokemondb.net/pokedex/hydrapple,Hydrapple,"Grass, Dragon",93.0,180.0,"{'Nor': 1.0, 'Fir': 1.0, 'Wat': 0.25, 'Ele': 0.25, 'Gra': 0.25, 'Ice': 4.0, 'Fig': 1.0, 'Poi': 2.0, 'Gro': 0.5}",Sticky Hold; Regenerator; Supersweet Syrup,https://pokemondb.net/ability/sticky-hold; https://pokemondb.net/ability/regenerator; https://pokemondb.net/ability/supersweet-syrup,"Sticky Hold prevents held items from being taken or switched. If a Pokémon with Sticky Hold is the leading party Pokémon, the chance of hooking a Pokémon during fishing increases.; A Pokémon with Regenerator restores 1 ⁄ 3 of its maximum HP when switching out.; A sickly sweet scent spreads across the field the first time the Pokémon enters a battle, lowering the evasiveness of opposing Pokémon.",None,None,None,None,None
1010,https://pokemondb.net/pokedex/iron-leaves,Iron Leaves,"Grass, Psychic",125.0,150.0,"{'Nor': 1.0, 'Fir': 2.0, 'Wat': 0.5, 'Ele': 0.5, 'Gra': 0.5, 'Ice': 2.0, 'Fig': 0.5, 'Poi': 2.0, 'Gro': 0.5}",Quark Drive,https://pokemondb.net/ability/quark-drive,"Raises highest stat on Electric Terrain, or if holding Booster Energy.",None,None,None,None,None
1009,https://pokemondb.net/pokedex/walking-wake,Walking Wake,"Water, Dragon",280.0,350.0,"{'Nor': 1.0, 'Fir': 0.25, 'Wat': 0.25, 'Ele': 1.0, 'Gra': 1.0, 'Ice': 1.0, 'Fig': 1.0, 'Poi': 1.0, 'Gro': 1.0}",Protosynthesis,https://pokemondb.net/ability/protosynthesis,"Raises highest stat in harsh sunlight, or if holding Booster Energy.",None,None,None,None,None
1008,https://pokemondb.net/pokedex/miraidon,Miraidon,"Electric, Dragon",240.0,350.0,"{'Nor': 1.0, 'Fir': 0.5, 'Wat': 0.5, 'Ele': 0.25, 'Gra': 0.5, 'Ice': 2.0, 'Fig': 1.0, 'Poi': 1.0, 'Gro': 2.0}",Hadron Engine,https://pokemondb.net/ability/hadron-engine,"Creates an Electric Terrain when entering battle, and boosts Special Attack while active.",None,None,None,None,None
1007,https://pokemondb.net/pokedex/koraidon,Koraidon,"Fighting, Dragon",303.0,250.0,"{'Nor': 1.0, 'Fir': 0.5, 'Wat': 0.5, 'Ele': 0.5, 'Gra': 0.5, 'Ice': 2.0, 'Fig': 1.0, 'Poi': 1.0, 'Gro': 1.0}",Orichalcum Pulse,https://pokemondb.net/ability/orichalcum-pulse,"Turns the sunlight harsh when entering battle, and boosts Attack while active.",None,None,None,None,None
1006,https://pokemondb.net/pokedex/iron-valiant,Iron Valiant,"Fairy, Fighting",35.0,140.0,"{'Nor': 1.0, 'Fir': 1.0, 'Wat': 1.0, 'Ele': 1.0, 'Gra': 1.0, 'Ice': 1.0, 'Fig': 0.5, 'Poi': 2.0, 'Gro': 1.0}",Quark Drive,https://pokemondb.net/ability/quark-drive,"Raises highest stat on Electric Terrain, or if holding Booster Energy.",None,None,None,None,None
1005,https://pokemondb.net/pokedex/roaring-moon,Roaring Moon,"Dragon, Dark",380.0,200.0,"{'Nor': 1.0, 'Fir': 0.5, 'Wat': 0.5, 'Ele': 0.5, 'Gra': 0.5, 'Ice': 2.0, 'Fig': 2.0, 'Poi': 1.0, 'Gro': 1.0}",Protosynthesis,https://pokemondb.net/ability/protosynthesis,"Raises highest stat in harsh sunlight, or if holding Booster Energy.",None,None,None,None,None
1004,https://pokemondb.net/pokedex/chi-yu,Chi-Yu,"Dark, Fire",4.9,40.0,"{'Nor': 1.0, 'Fir': 0.5, 'Wat': 2.0, 'Ele': 1.0, 'Gra': 0.5, 'Ice': 0.5, 'Fig': 2.0, 'Poi': 1.0, 'Gro': 2.0}",Beads of Ruin,https://pokemondb.net/ability/beads-of-ruin,Lowers Special Defense of all Pokémon except itself.,None,None,None,None,None
1003,https://pokemondb.net/pokedex/ting-lu,Ting-Lu,"Dark, Ground",699.7,270.0,"{'Nor': 1.0, 'Fir': 1.0, 'Wat': 2.0, 'Ele': 0.0, 'Gra': 2.0, 'Ice': 2.0, 'Fig': 2.0, 'Poi': 0.5, 'Gro': 1.0}",Vessel of Ruin,https://pokemondb.net/ability/vessel-of-ruin,Lowers Special Attack of all Pokémon except itself.,None,None,None,None,None
1002,https://pokemondb.net/pokedex/chien-pao,Chien-Pao,"Dark, Ice",152.2,190.0,"{'Nor': 1.0, 'Fir': 2.0, 'Wat': 1.0, 'Ele': 1.0, 'Gra': 1.0, 'Ice': 0.5, 'Fig': 4.0, 'Poi': 1.0, 'Gro': 1.0}",Sword of Ruin,https://pokemondb.net/ability/sword-of-ruin,Lowers Defense of all Pokémon except itself.,None,None,None,None,None
1001,https://pokemondb.net/pokedex/wo-chien,Wo-Chien,"Dark, Grass",74.2,150.0,"{'Nor': 1.0, 'Fir': 2.0, 'Wat': 0.5, 'Ele': 0.5, 'Gra': 0.5, 'Ice': 2.0, 'Fig': 2.0, 'Poi': 2.0, 'Gro': 0.5}",Tablets of Ruin,https://pokemondb.net/ability/tablets-of-ruin,Lowers Attack of all Pokémon except itself.,None,None,None,None,None
1000,https://pokemondb.net/pokedex/gholdengo,Gholdengo,"Steel, Ghost",30.0,120.0,"{'Nor': 0.0, 'Fir': 2.0, 'Wat': 1.0, 'Ele': 1.0, 'Gra': 0.5, 'Ice': 0.5, 'Fig': 0.0, 'Poi': 0.0, 'Gro': 2.0}",Good as Gold,https://pokemondb.net/ability/good-as-gold,Gives immunity to status moves.,None,None,None,None,None
999,https://pokemondb.net/pokedex/gimmighoul,Gimmighoul,Ghost,5.0,30.0,"{'Nor': 0.0, 'Fir': 1.0, 'Wat': 1.0, 'Ele': 1.0, 'Gra': 1.0, 'Ice': 1.0, 'Fig': 0.0, 'Poi': 0.5, 'Gro': 1.0}",Rattled,https://pokemondb.net/ability/rattled,"When a Pokémon with Rattled is hit by a Bug , Ghost or Dark type move, its Speed is raised one stage (up to the usual maximum of +6 stages).",1000,None,None,Gholdengo,https://pokemondb.net/pokedex/gholdengo
997,https://pokemondb.net/pokedex/arctibax,Arctibax,"Dragon, Ice",30.0,80.0,"{'Nor': 1.0, 'Fir': 1.0, 'Wat': 0.5, 'Ele': 0.5, 'Gra': 0.5, 'Ice': 1.0, 'Fig': 2.0, 'Poi': 1.0, 'Gro': 1.0}",Ice Body; Thermal Exchange,https://pokemondb.net/ability/ice-body; https://pokemondb.net/ability/thermal-exchange,"A Pokémon with Ice Body will recover 1 ⁄ 16 of its maximum HP during hail, after each turn. It also grants immunity to the hailstorm damage, if not already immune.; Raises Attack when hit by a Fire-type move. Cannot be burned.",998,None,None,Baxcalibur,https://pokemondb.net/pokedex/baxcalibur
998,https://pokemondb.net/pokedex/baxcalibur,Baxcalibur,"Dragon, Ice",210.0,210.0,"{'Nor': 1.0, 'Fir': 1.0, 'Wat': 0.5, 'Ele': 0.5, 'Gra': 0.5, 'Ice': 1.0, 'Fig': 2.0, 'Poi': 1.0, 'Gro': 1.0}",Ice Body; Thermal Exchange,https://pokemondb.net/ability/ice-body; https://pokemondb.net/ability/thermal-exchange,"A Pokémon with Ice Body will recover 1 ⁄ 16 of its maximum HP during hail, after each turn. It also grants immunity to the hailstorm damage, if not already immune.; Raises Attack when hit by a Fire-type move. Cannot be burned.",None,None,None,None,None
1011,https://pokemondb.net/pokedex/dipplin,Dipplin,"Grass, Dragon",4.4,40.0,"{'Nor': 1.0, 'Fir': 1.0, 'Wat': 0.25, 'Ele': 0.25, 'Gra': 0.25, 'Ice': 4.0, 'Fig': 1.0, 'Poi': 2.0, 'Gro': 0.5}",Sticky Hold; Gluttony; Supersweet Syrup,https://pokemondb.net/ability/sticky-hold; https://pokemondb.net/ability/gluttony; https://pokemondb.net/ability/supersweet-syrup,"Sticky Hold prevents held items from being taken or switched. If a Pokémon with Sticky Hold is the leading party Pokémon, the chance of hooking a Pokémon during fishing increases.; A Pokémon with Gluttony will use a pinch berry when its HP drops to 50%, rather than the usual 25%. Pinch berries are: Figy, Wiki, Mago, Aguav, Iapapa, Liechi, Ganlon, Salac, Petaya, Apicot, Lansat, Starf, Micle and Custap. (Their descriptions state that they work in a pinch. ); A sickly sweet scent spreads across the field the first time the Pokémon enters a battle, lowering the evasiveness of opposing Pokémon.",None,None,None,None,None
1012,https://pokemondb.net/pokedex/poltchageist,Poltchageist,"Grass, Ghost",1.1,10.0,"{'Nor': 0.0, 'Fir': 2.0, 'Wat': 0.5, 'Ele': 0.5, 'Gra': 0.5, 'Ice': 2.0, 'Fig': 0.0, 'Poi': 1.0, 'Gro': 0.5}",Heatproof; Hospitality,https://pokemondb.net/ability/heatproof; https://pokemondb.net/ability/hospitality,"Heatproof reduces the damage taken from Fire -type moves by 50%. It also halves the damage from a burn, from 1 ⁄ 8 to 1 ⁄ 16 of the Pokémon's maximum HP.; When the Pokémon enters a battle, it showers its ally with hospitality, restoring a small amount of the ally's HP.",1013,None,None,Sinistcha,https://pokemondb.net/pokedex/sinistcha
995,https://pokemondb.net/pokedex/iron-thorns,Iron Thorns,"Rock, Electric",303.0,160.0,"{'Nor': 0.5, 'Fir': 0.5, 'Wat': 2.0, 'Ele': 0.5, 'Gra': 2.0, 'Ice': 1.0, 'Fig': 2.0, 'Poi': 0.5, 'Gro': 4.0}",Quark Drive,https://pokemondb.net/ability/quark-drive,"Raises highest stat on Electric Terrain, or if holding Booster Energy.",None,None,None,None,None
994,https://pokemondb.net/pokedex/iron-moth,Iron Moth,"Fire, Poison",36.0,120.0,"{'Nor': 1.0, 'Fir': 0.5, 'Wat': 2.0, 'Ele': 1.0, 'Gra': 0.25, 'Ice': 0.5, 'Fig': 0.5, 'Poi': 0.5, 'Gro': 4.0}",Quark Drive,https://pokemondb.net/ability/quark-drive,"Raises highest stat on Electric Terrain, or if holding Booster Energy.",None,None,None,None,None
993,https://pokemondb.net/pokedex/iron-jugulis,Iron Jugulis,"Dark, Flying",111.0,130.0,"{'Nor': 1.0, 'Fir': 1.0, 'Wat': 1.0, 'Ele': 2.0, 'Gra': 0.5, 'Ice': 2.0, 'Fig': 1.0, 'Poi': 1.0, 'Gro': 0.0}",Quark Drive,https://pokemondb.net/ability/quark-drive,"Raises highest stat on Electric Terrain, or if holding Booster Energy.",None,None,None,None,None
